{
    "id": "76749",
    "name": {
        "en": "Ciudad Del Carmen / Palmas"
    },
    "country": "MX",
    "region": "CAM",
    "identifiers": {
        "$wmo": "76749",
        "$icao": "MMCE",
        "$iata": "CME",
        "$usaf": "767493"
    },
    "location": {
        "latitude": 18.6518,
        "longitude": -91.7994,
        "elevation": 3
    },
    "timezone": "America/Merida"
}