{
    "id": "16168",
    "name": {
        "en": "Monte Argentario"
    },
    "country": "IT",
    "region": "52",
    "identifiers": {
        "wmo": "16168",
        "icao": "LIQO",
        "usaf": "161680"
    },
    "location": {
        "latitude": 42.3833,
        "longitude": 11.1667,
        "elevation": 630
    },
    "timezone": "Europe/Rome"
}