{
    "id": "02942",
    "name": {
        "en": "Niinisalo"
    },
    "country": "FI",
    "region": null,
    "identifiers": {
        "$wmo": "02942",
        "$ghcn": "FIE00143381",
        "$usaf": "029420"
    },
    "location": {
        "latitude": 61.85,
        "longitude": 22.4667,
        "elevation": 134
    },
    "timezone": "Europe/Helsinki"
}