{
    "id": "60KP4",
    "name": {
        "en": "Manti-Ephraim Airport"
    },
    "country": "US",
    "region": "UT",
    "identifiers": {
        "icao": "K41U"
    },
    "location": {
        "latitude": 39.33133,
        "longitude": -111.61273,
        "elevation": 1676
    },
    "timezone": "America/Denver"
}