{
    "id": "91831",
    "name": {
        "en": "Aitutaki Aws"
    },
    "country": "CK",
    "region": null,
    "identifiers": {
        "$wmo": "91831",
        "$icao": "NCAI",
        "$iata": "AIT",
        "$usaf": "918300"
    },
    "location": {
        "latitude": -18.8333,
        "longitude": -159.7667,
        "elevation": 5
    },
    "timezone": "Pacific/Rarotonga"
}