{
    "id": "99207",
    "name": {
        "en": "Buoy"
    },
    "country": "US",
    "region": null,
    "identifiers": {
        "$wmo": "99207",
        "$icao": "KC7H"
    },
    "location": {
        "latitude": 38.5,
        "longitude": -70.7,
        "elevation": 3
    },
    "timezone": "America/New_York"
}