{
    "id": "KEVB0",
    "name": {
        "en": "New Smyrna Beach / Isleboro"
    },
    "country": "US",
    "region": "FL",
    "identifiers": {
        "$icao": "KEVB",
        "$wban": "92808",
        "$usaf": "722361"
    },
    "location": {
        "latitude": 29.0557,
        "longitude": -80.9489,
        "elevation": 3
    },
    "timezone": "America/New_York"
}