{
    "id": "15200",
    "name": {
        "en": "Arad"
    },
    "country": "RO",
    "region": "AR",
    "identifiers": {
        "wmo": "15200",
        "icao": "LRAR",
        "iata": "ARW",
        "usaf": "152000",
        "mosmix": "15200"
    },
    "location": {
        "latitude": 46.2,
        "longitude": 21.4,
        "elevation": 117
    },
    "timezone": "Europe/Bucharest"
}