{
    "id": "03900",
    "name": {
        "en": "Knockarevan"
    },
    "country": "GB",
    "region": "NIR",
    "identifiers": {
        "$wmo": "03900"
    },
    "location": {
        "latitude": 54.4167,
        "longitude": -8.0833,
        "elevation": 50
    },
    "timezone": "Europe/London"
}