{
    "id": "94497",
    "name": {
        "en": "Wanaaring"
    },
    "country": "AU",
    "region": "NSW",
    "identifiers": {
        "wmo": "94497",
        "ghcn": "ASN00048079"
    },
    "location": {
        "latitude": -29.7,
        "longitude": 144.1,
        "elevation": 108
    },
    "timezone": "Australia/Sydney"
}