{
    "id": "02342",
    "name": {
        "en": "Fransta Ã…lsta"
    },
    "country": "SE",
    "region": "Y",
    "identifiers": {
        "$wmo": "02342"
    },
    "location": {
        "latitude": 62.5167,
        "longitude": 16.1833,
        "elevation": 105
    },
    "timezone": "Europe/Stockholm"
}