{
    "id": "80132",
    "name": {
        "en": "Tame / Tame"
    },
    "country": "CO",
    "region": "ARA",
    "identifiers": {
        "$wmo": "80132",
        "$icao": "SKTM",
        "$iata": "TME"
    },
    "location": {
        "latitude": 6.45,
        "longitude": -71.75,
        "elevation": 350
    },
    "timezone": "America/Bogota"
}