{
    "id": "47870",
    "name": {
        "en": "Tanegashima Airport"
    },
    "country": "JP",
    "region": "46",
    "identifiers": {
        "wmo": "47870",
        "icao": "RJFG",
        "usaf": "478700"
    },
    "location": {
        "latitude": 30.55,
        "longitude": 130.95,
        "elevation": 92
    },
    "timezone": "Asia/Tokyo"
}