{
    "id": "KQHT0",
    "name": {
        "en": "Manas / Ak-Kashat"
    },
    "country": "KG",
    "region": "C",
    "identifiers": {
        "icao": "KQHT"
    },
    "location": {
        "latitude": 43.07,
        "longitude": 74.2,
        "elevation": 756
    },
    "timezone": "Asia/Bishkek"
}