{
    "id": "ZBP57",
    "name": {
        "en": "Veiholmen"
    },
    "country": "NO",
    "region": null,
    "identifiers": {
        "national": "SN65310",
        "wmo": "01225"
    },
    "location": {
        "latitude": 63.519,
        "longitude": 7.953,
        "elevation": 5
    },
    "timezone": "Europe/Oslo"
}