{
    "id": "21921",
    "name": {
        "en": "Kjusjur"
    },
    "country": "RU",
    "region": "SA",
    "identifiers": {
        "$wmo": "21921",
        "$ghcn": "RSM00021921"
    },
    "location": {
        "latitude": 70.6833,
        "longitude": 127.4,
        "elevation": 39
    },
    "timezone": "Asia/Yakutsk"
}