{
    "id": "47169",
    "name": {
        "en": "Heuksando / Ye-ri"
    },
    "country": "KR",
    "region": "KJ",
    "identifiers": {
        "$wmo": "47169"
    },
    "location": {
        "latitude": 34.6872,
        "longitude": 125.4511,
        "elevation": 77
    },
    "timezone": "Asia/Seoul"
}