{
    "id": "86834",
    "name": {
        "en": "Maracaju"
    },
    "country": "BR",
    "region": "MS",
    "identifiers": {
        "$wmo": "86834",
        "$usaf": "868340"
    },
    "location": {
        "latitude": -21.6092,
        "longitude": -55.1778,
        "elevation": 401
    },
    "timezone": "America/Campo_Grande"
}