{
    "id": "99689",
    "name": {
        "en": "Buoy (GBR) / Whitbeck"
    },
    "country": "XA",
    "region": null,
    "identifiers": {
        "$wmo": "99689"
    },
    "location": {
        "latitude": 54.1,
        "longitude": -3.6,
        "elevation": 3
    },
    "timezone": "Europe/London"
}