{
    "id": "94086",
    "name": {
        "en": "Kalamadu / Kulumadau"
    },
    "country": "PG",
    "region": "MB",
    "identifiers": {
        "$wmo": "94086"
    },
    "location": {
        "latitude": -9.0833,
        "longitude": 152.75,
        "elevation": 122
    },
    "timezone": "Pacific/Port_Moresby"
}