{
    "id": "06619",
    "name": {
        "en": "Fretaz La / Vugelles"
    },
    "country": "CH",
    "region": "VD",
    "identifiers": {
        "$wmo": "06619",
        "$mosmix": "06619"
    },
    "location": {
        "latitude": 46.8406,
        "longitude": 6.5764,
        "elevation": 1205
    },
    "timezone": "Europe/Zurich"
}