{
    "id": "29802",
    "name": {
        "en": "Mikhailovka"
    },
    "country": "KZ",
    "region": "55",
    "identifiers": {
        "wmo": "29802",
        "ghcn": "KZ000029802",
        "usaf": "298020"
    },
    "location": {
        "latitude": 53.8167,
        "longitude": 76.5333,
        "elevation": 0
    },
    "timezone": "Asia/Almaty"
}