{
    "id": "04235",
    "name": {
        "en": "Dye 1 / Ikerasaarsuk"
    },
    "country": "GL",
    "region": "QT",
    "identifiers": {
        "$wmo": "04235"
    },
    "location": {
        "latitude": 66.6333,
        "longitude": -52.8667,
        "elevation": 1453
    },
    "timezone": "America/Godthab"
}