{
    "id": "41526",
    "name": {
        "en": "Babusar / Doma?n"
    },
    "country": "PK",
    "region": "NA",
    "identifiers": {
        "$wmo": "41526"
    },
    "location": {
        "latitude": 35.2167,
        "longitude": 74.1,
        "elevation": 2854
    },
    "timezone": "Asia/Karachi"
}